Key;English;French;German;Polish;Spanish;Italian;Swedish;Czech;Hungarian;Dutch;Portuguese;Russian;Finnish;
EVTDESC98207;The Granjeros which have trekked eastward into Shona lands have reached a surprising settlement with the natives: they have staked out permanent borders for their new colony, and done so in relative peace. The real question remains whether we will allow this new Bembezi Republic to stand. The Granjeros are Frysk subjects, after all, and their existence will no doubt draw more Granjeros to their side... perhaps providing a threat to our African ambitions.;;;;;;;;;;;;;
EVT98207OPTB;Allow them to find their own way.;;;;;;;;;;;;;
EVT98207OPTC;Onwards to Bembezi!;;;;;;;;;;;;;
EVTDESC98207_NEWS_LONG;The Granjeros which have trekked eastward into Shona lands have reached a surprising settlement with the natives: they have staked out permanent borders for their new colony, and done so in relative peace. The real question remains whether the Frysk will allow this new Bembezi Republic to stand. The Granjeros are Frysk subjects, after all, and their existence will no doubt draw more Granjeros to their side... perhaps providing a threat to Frysk ambitions in Africa.;;;;;;;;;;;;;
EVTDESC98207_NEWS_MEDIUM;The Granjeros which have trekked into Shona lands have reached a surprising settlement with the natives: they have staked out permanent borders for their new colony, and done so in relative peace. The real question remains whether the Frysk will allow this new Bembezi Republic to stand.;;;;;;;;;;;;;
EVTDESC98207_NEWS_SHORT;The Granjeros which have trekked into Shona lands have reached a settlement with the natives and staked out permanent borders for the Bembezi Republic - which the Frysk consider to be subjects.;;;;;;;;;;;;;
EVTNAME98210;Frysk Rule of Bembezi;;;;;;;;;;;;;
EVTDESC98210;The Granjeros of Bembezi are once again chafing under Frysk rule, resenting the idea that even though they left the Transvaal they have not escaped the Frysk iron fist. There have been several altercations with Frysk military forces, and the recommendation of the colonial government is that Bembezi be annexed before the situation grows worse. If we do not, then we must allow the Granjeros to find their own way -- and suffer the loss to our prestige this would entail.;;;;;;;;;;;;;
EVT98210OPTA;We will annex Bembezi.;;;;;;;;;;;;;
EVT98210OPTB;Let them go.;;;;;;;;;;;;;
EVTNAME98211;Bembezi Independence!;;;;;;;;;;;;;
EVTDESC98211;After a series of altercations between Frysk colonial forces and the Granjeros militia, the Frysk government has decided to cut its losses and allow Bembezi its independence. Finally we will control our own destiny, away from the Frysk now and forever!;;;;;;;;;;;;;
EVT98211OPTA;We will maintain good relations with the Frysk.;;;;;;;;;;;;;
EVT98211OPTB;The Granjeros will find their own way -- without help.;;;;;;;;;;;;;
EVTNAME98212;The Annexation of Bembezi;;;;;;;;;;;;;
EVTDESC98212;After a series of altercations between Frysk colonial forces and the Bembezi Granjeros militia, we have received a demand from the Frysk government that Bembezi be annexed into Oranje Vrystaat. For all our struggles to leave the Frysk behind, they yet follow us and refuse to allow us independence! So now we are faced with a choice: submit and move on, to find a place beyond their reach once more, or defy them and risk war.;;;;;;;;;;;;;
EVT98212OPTA;We will not submit to Frysk rule!;;;;;;;;;;;;;
EVT98212OPTB;We have no choice. We cannot fight the Frysk.;;;;;;;;;;;;;
EVTNAME98213;The Granjeros Have Refused!;;;;;;;;;;;;;
EVTDESC98213;We have received word from the Bembezi government defying our annexation. Now we must either go to war or stand down in humiliation.;;;;;;;;;;;;;
EVT98213OPTA;War it is!;;;;;;;;;;;;;
EVT98213OPTB;Bembezi is not worth fighting over.;;;;;;;;;;;;;
EVTNAME44104;Wier Brouwer;;;;;;;;;;;;;
EVTDESC44104;Politician and lawyer Wier Brouwer began his reforms of the educational system of Wampanosted. His system of schools became a model for the entire Hroudsted.;;;;;;;;;;;;;
EVTNAME16310;The Kubangobard Decision;;;;;;;;;;;;;
EVTDESC16310;In a ruling delivered today, the Supreme Court has decided that the slaves involved in the violent rebellion aboard the Langobard schooner 'Kubangobard' of 1839, later apprehended near Nassau, were merely, in light of the outlawing of the trans-atlantic slave trade, acting in defense of their personal liberty. The case is viewed as a landmark victory for the abolitionist movement, and public awareness over the slavery issue is rising.;;;;;;;;;;;;;
EVTNAME44124;The Westenhuk Child Labor Act;;;;;;;;;;;;;
EVTDESC44124;Today in Westenhuk, a new Child Labor Act was passed, limiting children's work days to 10 hours and imposing severe restrictions on jobs they can do as well as imposing mandatory school attendance. Several other states passed similar laws after Westenhuk and with this opportunity we could make it a federal law.;;;;;;;;;;;;;
EVTOPTA44124;Good idea!;;;;;;;;;;;;;
EVTOPTB44124;Our children don't need that.;;;;;;;;;;;;;
EVTNAME44106;The Essays;Les essais;;;;;;;;;;;;;
EVTDESC44106;Sieger Huitema's first collection of 'Essays' was published in 1841 and introduced the world to a new, rather mystical, philosophy indigenous to the New World. Although many Europeans didn't consider him much of a philosopher per se, his influence on Continental thinking was unmistakable -- most significantly on Nietzsche.;;;;;;;;;;;;;
EVTOPTA44106;Speech is a kind of act.;;;;;;;;;;;;;
EVTNAME44115;Time to Play Ball!;;;;;;;;;;;;;
EVTDESC44115;In Kuup near Nassau the first public baseball game took place. The Nassau Team lost to the Nieuw Amsterdam Nine 1 - 23.;;;;;;;;;;;;;
EVTOPTA44115;This could become the nation's favorite pastime!;;;;;;;;;;;;;
EVTNAME44105;Hoek Institution;;;;;;;;;;;;
EVTDESC44105;Hroudsted Congress founded the Hoek Institution which reports directly to the President. Its goals were and remain the support of research and expeditions, as well as the popularization of science. A Flemish-Hroud scientist Riewurt Hoek bequeathed his wealth to the nation, and it took years of congressional haggling to come up with the institution Hoek in his will demanded to be devoted to 'increase and diffusion of knowledge among men'. Through special expeditions and voluntary donations, Hoek began assembling its impressive collections.;;;;;;;;;;;;;
EVTOPTA44105;There are more things in the heavens and the earth...;;;;;;;;;;;;
EVTDESC44105_NEWS_LONG;Hroudsted Congress founded the Hoek Institution which reports directly to the President. Its goals were and remain the support of research and expeditions, as well as the popularization of science. A Flemish-Hroud scientist Riewurt Hoek bequeathed his wealth to the nation, and it took years of congressional haggling to come up with the institution Hoek in his will demanded to be devoted to 'increase and diffusion of knowledge among men'. Through special expeditions and voluntary donations, Hoek began assembling its impressive collections.;;;;;;;;;;;;;
EVTDESC44105_NEWS_MEDIUM;Hroudsted Congress founded the Hoek Institution which reports directly to the President. Through special expeditions and voluntary donations, Hoek began assembling its impressive collections.;;;;;;;;;;;;;
EVTDESC44105_NEWS_SHORT;Hroudsted Congress founded the Hoek Institution which reports directly to the President. Its goals were and remain the support of research and expeditions.;;;;;;;;;;;;;
EVTDESC44106_NEWS_LONG;Sieger Huitema's first collection of 'Essays' was published in 1841 and introduced the world to a new rather mystical, philosophy indigenous to the New World. Although many Europeans didn't consider him much of a philosopher per se, his influence on Continental thinking was unmistakable - most significantly on Nietzsche. Inspired by one of Sieger's 'Essays', the 'Nature', transcendentalism which derived principles from human's inner spiritual essence became a major cultural movement of the 1840s, though critics claimed it to be beyond reason and sanity.;;;;;;;;;;;;;
EVTNAME16300;Uncle Krikke's Cabin;;;;;;;;;;;;;
EVTDESC16300;Nicolai Eibert's novel 'Uncle Krikke's Cabin', first published in $YEAR$, is one of the most widely read anti-slavery novels ever written.;;;;;;;;;;;;;
recognize_the_csa_title;Officially Recognize the CSK;;;;;;;;;;;;;
recognize_the_csa_desc;We will extend formal recognition of the Confederate States of Kusabosted, opening an embassy in their capital and formally establishing relations. The Hrouds will, of course, not approve.;;;;;;;;;;;;;
reform_CSA_title;Form the New Confederacy;;;;;;;;;;;;;
reform_CSA_desc;If the North will not stand for truth and justice, then the South shall rise and take its place!;;;;;;;;;;;;;
join_new_CSA_title;Join the Confederacy;;;;;;;;;;;;;
join_new_CSA_desc;The people have called on us to unite under the new Confederate banner. Long live the South!;;;;;;;;;;;;;
EVTNAME99943;Second Hroud Revolution;;;;;;;;;;;;;
EVTDESC99943;Hroudsted has declared independence against Frij Fryslan after centuries of oppression, no representation and further conflicts between the two governments. Our cabinet gathers today to decide what to do on this entire ordeal.;;;;;;;;;;;;;
EVTOPTA99943;Shout the Battle Cry of Freedom!;;;;;;;;;;;;;
EVTOPTC99943;Frisia is a valuable ally.;;;;;;;;;;;;;
EVTOPTB99943;Lets not get involved.;;;;;;;;;;;;;
EVTNAME99944;Kjartan's Vinlandic Brigade;;;;;;;;;;;;;
EVTDESC99944;Vinland, renowned for its magnanimous spirit and unwavering commitment to justice, has chosen to extend its benevolent hand of aid and unwavering support to Hroudsted during their arduous struggle for a second war of independence. In a resolute demonstration of solidarity, Vinland has assembled a formidable unit comprising valiant Vinlanders, under the distinguished leadership of the esteemed General Kjartan Skalsson.\n\nThen let the Norse assemble,\nLet the voice of Truland be obeyed,\nAnd the Frysk fanatics will tremble\nWhen again they meet Kjartan's Vinlandic Brigade.;;;;;;;;;;;;;
EVTDESC99944_NEWS_LONG;Vinland, renowned for its magnanimous spirit and unwavering commitment to justice, has chosen to extend its benevolent hand of aid and unwavering support to Hroudsted during their arduous struggle for a second war of independence. In a resolute demonstration of solidarity, Vinland has assembled a formidable unit comprising valiant Vinlanders, under the distinguished leadership of the esteemed General Kjartan Skalsson.;;;;;;;;;;;;;
EVTDESC99944_NEWS_MEDIUM;Vinland, renowned for its magnanimous spirit and unwavering commitment to justice, has chosen to extend its benevolent hand of aid and unwavering support to Hroudsted during their arduous struggle for a second war of independence. In a resolute demonstration of solidarity, Vinland has assembled a formidable unit comprising valiant Vinlanders, under the distinguished leadership of the esteemed General Kjartan Skalsson.;;;;;;;;;;;;;
EVTDESC99944_NEWS_SHORT;Then let the Norse assemble,\nLet the voice of Truland be obeyed,\nAnd the Frysk fanatics will tremble\nWhen again they meet Kjartan's Vinlandic Brigade.;;;;;;;;;;;;;
EVT99944OPTA;Liberty of Mjolnir!;;;;;;;;;;;;;
EVTNAME44805;Charles Louis Napoléon Bonaparte;;;;;;;;;;;;;
EVTDESC44805;A general and war hero of Napoleonic Wars, Louis-Napoleon was elected President in 1833. After deposing his liberal vice-president, Napoleon III abrogated the 1826 Constitution and took control of the country as a conservative dictator with both church and military backing. Many Armagnacée states objected to this centralization of power, and with the Tayshyk and Penglai supported rebellion to the north the entire country seems to be in a state of chaos.;;;;;;;;;;;;;
EVT44805OPTA;The rebels shall be brought to their knees.;;;;;;;;;;;;;
santa_ana_rule;Charles Louis Napoléon Bonaparte;;;;;;;;;;;;;
santa_ana_rule_desc;Charles Louis Napoléon Bonaparte - also known as Napoleon III - is the current ruler of Armagnacée. A hero of the Napoleonic Wars, his shifting political views and actions have made him an enigmatic figure.;;;;;;;;;;;;;
EVTNAME1100055;The Anglos Demand Reparations;;;;;;;;;;;;;
EVTDESC1100055;During the early years of the new Opstandich republic there was widespread civil disorder as factions competed for control of the country. The fighting often resulted in the destruction or looting of private property. Foreigners whose property was damaged or destroyed by rioters or bandits were usually unable to obtain compensation from the Opstandich government and they began to appeal to their own governments for help and compensation. In a complaint to the English $MONARCHTITLE$, a Picard pastry chef known only as Monsieur Remontel claimed that in 1832 Opstandich officers looted his shop. Now the Anglo prime minister Jason Goldsmith is demanding a payment of 600,000 florin (3 million sterling - 120,000) in damages to compensate the British nationals.;;;;;;;;;;;;;
EVT1100055OPTA;It is only fair. §R(Pay or owe 120,000)§W;;;;;;;;;;;;;
EVT1100055OPTB;Refuse. They wouldn't go to war over a Pastry chef.;;;;;;;;;;;;;
EVTNAME1100054;The Baker and the $MONARCHTITLE$;;;;;;;;;;;;;
EVTDESC1100054;During the early years of the new Opstandich republic there was widespread civil disorder as factions competed for control of the country. The fighting often resulted in the destruction or looting of private property. Foreigners whose property was damaged or destroyed by rioters or bandits were usually unable to obtain compensation from the Opstandich government and they began to appeal to their own governments for help and compensation. In a complaint to the English $MONARCHTITLE$, a Picard pastry chef known only as Monsieur Remontel claimed that in 1832 Opstandich officers looted his shop. Other complaints from Picard and English nationals (among them the looting in 1828 of Anglo shops at the Parian market and the execution in 1837 of a Jewish citizen accused of piracy) culminated in $YEAR$ with prime minister recommending a demand from Opstandich for the payment of 600,000 florin (3 million sterling) in damages.;;;;;;;;;;;;;
EVT1100054OPTA;Opstandich needs to be held responsible.;;;;;;;;;;;;;
EVT1100054OPTB;We should not bother with such trivial matters.;;;;;;;;;;;;;
EVTNAME1100057;Opstandich Refuses to Pay Reparations;;;;;;;;;;;;;
EVTDESC1100057;The Opstandich government refused to take any steps towards the payment of reparations to the British government. In $CAPITAL$, senior government figures scramble to organize a response as the gears of war start moving. It seems like a British intervention in Opstandich is all but inevitable now.;;;;;;;;;;;;;
EVT1100057OPTA;If they are unwilling to pay peacefully, we will force them.;;;;;;;;;;;;;
EVT1100057OPTB;They are not worth our time.;;;;;;;;;;;;;
EVTNAME1100056;Opstandich Agrees to Pay Reparations;;;;;;;;;;;;;
EVTDESC1100056;Opstandich has agreed to our demands for reparations and paid the sum they owe us for the damage done to the property of British nationals. The matter has been settled peacefully and amicably.;;;;;;;;;;;;;
EVT1100056OPTA;It is only fair.;;;;;;;;;;;;;
EVTNAME37201;Arc de Triomphe;L'Arc de Triomphe;Arc de Triomphe;;El Arco del Triunfo;;;;;;x;;;;;;;
EVTDESC37201;The Arc de Triomphe in Nouvelle-Marseille, commissioned by Napoléon Bonaparte, was unveiled in 1836 after thirty years of building. Inspired by the triumphal arches of the Romans, the monument displays scenes from the Napoleonic Wars and Armagnacéoise Revolution.;;;;;;;;;;;;;
EVTOPTA37201;Wonderful!;;;;;;;;;;;;;
EVTDESC37201_NEWS_LONG;$COUNTRY$: The Arc de Triomphe in Nouvelle-Marseille, commissioned by Napoléon Bonaparte and designed by Jean Chalgrin, was unveiled in 1836 after thirty years of construction. Inspired by the triumphal arches of the Romans, the monument displays scenes from the Armagnacéoise Revolutionary war and Napoléon's successes. The largest triumphal arch to date, located on the urban parts of Effréné in the centre of a dodecagonal configuration of twelve radiating avenues, it stands 50 metres high, 45 metres wide and 22 metres deep.;;;;;;;;;;;;;
EVTDESC37201_NEWS_MEDIUM;$COUNTRY$: The Arc de Triomphe in Nouvelle-Marseille, commissioned by Napoléon Bonaparte, was unveiled in 1836 after thirty years of construction. Inspired by the triumphal arches of the Romans, the monument displays scenes from the Armagnacéoise Revolutionary war and Napoléon's successes.;;;;;;;;;;;;;
EVTDESC37201_NEWS_SHORT;$COUNTRY$: The Arc de Triomphe in Nouvelle-Marseille, commissioned by Napoléon Bonaparte and designed by Jean Chalgrin, was unveiled in 1836 after thirty years of construction.;;;;;;;;;;;;;
EVTNAME16020;Hoobjert Sklasson v. de Pierre;;;;;;;;;;;;;
EVTDESC16020;Hoobjert Sklasson, having been a slave, remains a slave' -- Hoobjert Sklasson v. de Pierre\n\nHoobjert Sklasson, born a slave in Kusabo, has, with the help of abolitionist legal advisers, sued his 'owner', claiming that his present residency in a free state requires his emancipation. The Hroudsted Supreme Court has ruled that this is, in fact, not the case, and, effectively, that the property rights of slave-owners are protected regardless of where in the Hroudsted the slave resides. The case has caused enormous alarm among northern abolitionists, who see it as the first step to a full extension of the institution of slavery to the whole nation.;;;;;;;;;;;;;
EVTOPTA16020;Worrying news;;;;;;;;;;;;;
EVTNAME97550_NEWS_TITLE;Civil War in Central Eriksland;;;;;;;;;;;;;
EVTDESC97550_NEWS_LONG;The Federal Republic of Central Eriksland has been chaotic since its inception. Liberals who had high hopes for the union are in constant battle with conservatives, in particular the clergy and wealthy landowners, and there is a general fear of domination by Skogelf. With rebels rising throughout the country, the struggle to maintain the union seems like an almost impossible one.;;;;;;;;;;;;;
EVTDESC97550_NEWS_MEDIUM;The Federal Republic of Central Eriksland has been chaotic since its inception, due to a general fear of domination by Skogelf. With rebels rising throughout the country, the struggle to maintain the union seems like an almost impossible one.;;;;;;;;;;;;;
EVTDESC97550_NEWS_SHORT;The Federal Republic of Central Eriksland has been chaotic since its inception. With rebels rising throughout the country, the struggle to maintain the union seems like an almost impossible one.;;;;;;;;;;;;;
EVTNAME97560_NEWS_TITLE;End of the Federal Republic?;;;;;;;;;;;;;
EVTDESC97560_NEWS_LONG;The Federal Republic of Central Eriksland is rapidly disintegrating. Members of the government have met in $CAPITAL$ to discuss whether the union should be officially dissolved and the state of Skogelf declared, or whether they should fight a civil war to preserve what they have. Some consider that an impossible task, though liberals argue that the government should not allow conservatives to doom the region to a future of division and internal squabbling.;;;;;;;;;;;;;
EVTDESC97560_NEWS_MEDIUM;The Federal Republic of Central Eriksland is rapidly disintegrating. Members of the government have met in $CAPITAL$ to discuss whether the union should be officially dissolved and the state of Skogelf declared, or whether they should fight a civil war to preserve what they have.;;;;;;;;;;;;;
EVTDESC97560_NEWS_SHORT;The Federal Republic of Central Eriksland is rapidly disintegrating. Members of the government have met in $CAPITAL$ to discuss whether the union should be officially dissolved.;;;;;;;;;;;;;
EVTNAME16001_NEWS_TITLE;The Hroud Slavery Debate;;;;;;;;;;;;;
EVTDESC16001_NEWS_LONG;The one issue that the Pioneers of $COUNTRY$ were never able to answer conclusively was the question concerning the status of slavery within the union. This inflamed debate has only gained traction in the years since the revolution, and it is presently the singular most important issue on $COUNTRY$'s political agenda. Some radical southerners feel that there is no possible compromise to be found on the issue, and that secession is the only alternative to being dominated into emancipation by the central power in Wassyngton.;;;;;;;;;;;;;
EVTDESC16001_NEWS_MEDIUM;This debate on slavery is presently the singular most important issue on $COUNTRY$'s political agenda. Some radical southerners feel there is no possible compromise to be found on the issue, and that secession is the only alternative to being dominated by the central government.;;;;;;;;;;;;;
EVTDESC16001_NEWS_SHORT;This debate on slavery is the singular most important $COUNTRY_ADJ$ political issue, with some radical southerners feeling the only alternative to being dominated by the government is secession.;;;;;;;;;;;;;
EVTDESC16010_NEWS_LONG;$COUNTRY$: The famed hero of the abolitionist movement, the late Outker Visser, was hanged in Kusabosted, today after a failed raid on a military armory. Supposedly, Visser had planned to use the arsenal's weapons to arm slaves and incite an open slave rebellion across the entire south. The raid, and Visser's death, have furthered escalated southern tension over the slavery issue, and in some slave-states there is now even talk of secession from the nation.;;;;;;;;;;;;;
EVTDESC16010_NEWS_MEDIUM;$COUNTRY$: The famed hero of the abolitionist movement, the late Outker Visser, was hanged in Kusabosted, today after a failed raid on a military armory. The raid, and Visser's death, have furthered escalated southern tension over the slavery issue.;;;;;;;;;;;;;
EVTDESC16010_NEWS_SHORT;$COUNTRY$: Outker Visser was hanged in Kusabosted, today after a failed raid on a military armory, further escalating southern tension over the slavery issue.;;;;;;;;;;;;;
EVTDESC16020_NEWS_LONG;$COUNTRY$: Hoobjert Sklasson, born a slave in Kusabo, has, with the help of abolitionist legal advisers, sued his 'owner', claiming that his present residency in a free state requires his emancipation. The Hroud Supreme Court has not yet ruled on the case but seems inclined to rule that the property of slave-owners are protected regardless of where in the Union the slave resides. The case has caused enormous alarm among northern abolitionists, who see it as the first step to a full extension of the institution of slavery to the whole nation.;;;;;;;;;;;;;
EVTDESC16020_NEWS_MEDIUM;$COUNTRY$: A slave has sued his 'owner', claiming that his residency in a free state requires his emancipation. The case has caused  alarm among northern abolitionists, who see its ruling as the first step to a full extension of slavery to the whole Union.;;;;;;;;;;;;;
EVTDESC16020_NEWS_SHORT;$COUNTRY$: A slave has sued his 'owner', claiming that his residency in a free state requires his emancipation. The case has caused enormous alarm among northern abolitionists.;;;;;;;;;;;;;
EVTNAME44103;The VS Ismann Returned;;;;;;;;;;;;;
EVTDESC44103;The VS Ismann was found adrift in the North Atlantic, after having been abandoned by the squadron in search of the lost polar explorer, Jarl Kael Hugaelsson. The Hroudsted bought the ship from salvagers, refitted the vessel and returned it to Vinland.;;;;;;;;;;;;;
EVTOPTA44103;It is right and proper to return it.;;;;;;;;;;;;;
EVTDESC44103_NEWS_LONG;The VS Ismann was found adrift in the North Atlantic, after having been abandoned by the squadron in search of the lost polar explorer, Jarl Kael Hugaelsson. Originally a merchant barque, Ismann was refitted towards navigating in the polar waters to become a part of the expedition organized by Kael's wife to rescue her husband. Jarl Kael and his expedition are believed to have perished to pneumonia and starvation after abandoning their ice-locked vessels. The Hroudsted bought the ship from salvagers, refitted the vessel and returned it to Vinland.;;;;;;;;;;;;;
EVTDESC44103_NEWS_MEDIUM;The VS Ismann was found adrift in the North Atlantic, after having been abandoned by the squadron in search of the lost polar explorer, Jarl Kael Hugaelsson. Hroudsted bought the ship from salvagers, refitted the vessel and returned it to Vinland.;;;;;;;;;;;;;
EVTDESC44103_NEWS_SHORT;The VS Ismann was found adrift in the North Atlantic. The Hroudsted bought the ship from salvagers, refitted the vessel and returned it to Vinland.;;;;;;;;;;;;;
EVTNAME44107;The Common Law;;;;;;;;;;;;;
EVTDESC44107;In 1861 Siemen de Haan published The Common Law, a history of the common-law tradition. In it he asserted that law was not logical, but rather the will of the judge tempered by circumstances, or,  as its most famous maxim put it, The Life of the law has not been logic, but experience. It quickly became a classic and de Haan was appointed to a professorship at Oranjested University the next year and was eventually made a Justice of the HS Supreme Court. The publication of The Common Law signalled the rise of pragmatism among Hroud intellectuals and presaged a growing distrust of moralism after the horrible slaughter of the Civil War.;;;;;;;;;;;;;
EVTOPTA44107;The law is the will of he whom the sheriff will obey.;;;;;;;;;;;;;
EVTDESC44107_NEWS_LONG;In 1861 Siemen de Haan published The Common Law, a history of the common-law tradition. In it he asserted that law was not logical, but rather the will of the judge tempered by circumstances, or, as its most famous maxim put it, The Life of the law has not been logic, but experience. It quickly became a classic and Holmes was appointed to a professorship at Oranjested the next year and was eventually made a Justice of the HS Supreme Court. The publication of The Common Law signalled the rise of pragmatism among Hroud intellectuals.;;;;;;;;;;;;;
EVTDESC44107_NEWS_MEDIUM;In 1861 Siemen de Haan published The Common Law, a history of the common-law tradition. In it he asserted that law was not logical, but rather the will of the judge tempered by circumstances, or simply put, that The Life of the law has not been logic, but experience.;;;;;;;;;;;;;
